{
  "eventId":"4862ffc8-1bee-4cf6-af7e-33799dc4d44e",
  "userBarcode": "1000024158",
  "itemBarcode": "12983766",
  "object": "Manual Block",
  "action": "Deleted",
  "date": "2020-08-12T12:21:21.123",
  "servicePointId": "e7f1db20-3e78-4d74-abcb-cdff7d9e91ea",
  "description": "Manual Block test description"
}
