{
  "eventId":"a6231da4-f6fd-4845-8c5d-9c45a4fd4ae2",
  "userBarcode": "1000024158",
  "itemBarcode": "12983766",
  "object": "Patron Block",
  "action": "Edited",
  "date": "2020-08-12T12:21:21.123",
  "servicePointId": "e7f1db20-3e78-4d74-abcb-cdff7d9e91ea",
  "description": "Manual Block test description"
}
