{
  "eventId":"a6231da4-f6fd-4845-8c5d-9c45a4fd4ae2",
  "userBarcode": "1000024158",
  "itemBarcode": "12983766",
  "object": "Patron Block",
  "action": "Edited",
  "date": "2020-08-12T12:21:21.123",
  "servicePointId": "7c5abc9f-f3d7-4856-b8d7-6712462ca007",
  "source": "Truesdale, Yanic",
  "description": "Manual Block test description",
  "linkToIds": {
    "userId": "df7f4993-8c14-4a0f-ab63-93975ab01c76"
  }
}
