{
  "eventId":"f97da2d5-efdf-45d8-845f-d67b3bd19658",
  "userBarcode": "1000024158",
  "itemBarcode": "12983765",
  "object": "Fee/Fine",
  "action": "Billed",
  "date": "2020-08-12T12:21:21.123",
  "servicePointId": "e7f1db20-3e78-4d74-abcb-cdff7d9e91ea",
  "description": "Fee/Fine test description"
}
