{
  "eventId":"0c733b7d-22e4-46a6-8851-bf85c8c8eb5b",
  "userBarcode": "1000024158",
  "itemBarcode": "12983765",
  "object": "Item Block",
  "action": "Created",
  "date": "2020-08-12T12:21:21.123",
  "servicePointId": "7c5abc9f-f3d7-4856-b8d7-6712462ca007",
  "source": "Truesdale, Yanic",
  "description": "Item Block test description",
  "linkToIds": {
    "userId": "df7f4993-8c14-4a0f-ab63-93975ab01c76"
  }
}
